1,2,3,4,5,6,7,8,9,10,11,12,13,14,15,16,17,18,19,20,21,22,23,24,25
Buy and Try,Сбер,Сбер,Sportmaster Lab,Сбер,TISS,Evrone.com,Makves,Tennisi,Tennisi,Сбер,Сбер,Сбер,Сбер,Сбер,Tennisi,ЛАНИТ,Правое полушарие Интроверта,Tennisi,Вита,Garantex,Highglossy,Highglossy,Ростелеком,СберКорус
Symfony-разработчик,QA \ Инженер по тестированию (Интеграционные продукты),Архитектор (Платформа виртуализации),Аналитик SQL (клиентская аналитика),Team Lead-разработка на С (Системы хранения данных),Ведущий программист 1С/удаленно,Python backend developer (Senior\Lead),Presale инженер,Разработчик C# (инфраструктуры),Разработчик мобильного приложения ,Python-разработчик (Платформа Linux),QA инженер,Инженер по сопровождению,QA инженер (Инвестиции),Старший инженер группы сопровождения,Разработчик C#,Data scientist/ML engineer,Технический директор / Chief technology officer,DevOPS,Senior разработчик C# (WPF),Senior ruby developer,Fontend-разработчик (React / ReactNative),"Backend-разработчик (TypeScript, middle/senior)",Инженер мониторинга коммутационной сети,Инженер технической поддержки в группу эксплуатации промышленных сервисов
от 90 000 до 250 000 ₽,от 200 000 до 300 000 ₽,от 250 000 до 350 000 ₽,от 180 000 ₽,от 400 000 до 500 000 ₽,от 210 000 до 250 000 ₽,до 300 000 ₽,от 120 000 ₽,от 150 000 ₽,от 150 000 ₽,от 250 000 до 350 000 ₽,до 145 200 ₽,до 75 000 ₽,до 200 000 ₽,до 120 000 ₽,от 150 000 ₽,до 180 000 ₽,от 250 000 ₽,от 180 000 ₽,от 180 000 ₽,от 6000 $,от 140 000 ₽,от 140 000 ₽,от 45 000 до 60 000 ₽,от 120 000 до 150 000 ₽
"Symfony, PHP, PostgreSQL, AWS, Redis, RabbitMQ, Docker, Git, Nginx, Высоконагруженные системы","UI/UX дизайн, JavaScript, Cucumber, Python","DevOps, Разработка программного обеспечения",SQL,"C++, C, Linux","Разработка под 1С, MySQL, OData","PostgreSQL, Python, Docker, Kubernetes, Falcon, SQLalchemy, SOLID, Git-Flow","PostgreSQL, Базы данных, Linux, Администрирование Windows, Администрирование сетей, DNS, DHCP, Информационная безопасность","C#, SOLID, ASP.NET, RabbitMQ","Flutter, Web, Angular, Apache Cordova","Python, Linux","Java, REST, Apache Kafka",SQL,"Java, REST","Zabbix, Jenkins, Ansible, Администрирование Linux","C#, SOLID","Python, Алгоритмы и структуры данных, Прикладная математика, Компьютерное зрение, OpenCV, TensorFlow, Keras, PyTorch, Matlab, Нейронные сети","Управление проектами, Построение команды, Управление людьми, Scrum, Agile, Развитие бизнеса","CI/CD, OpenVPN","C#, WPF, MVVM, SOLID, Git, Адаптивная верстка","Ruby on Rails, Ruby, Git, Linux, GraphQL","JavaScript, TypeScript, React, React Native, Jest","TypeScript, Node.js, GraphQL, PostgreSQL, ООП, Паттерны проектирования, Функциональное программирование, Git, Linux","Zabbix, Мониторинг сетей, Телекоммуникации","Zabbix, Docker, Linux, Ansible, Python, Bash, Администрирование Windows"
"Полный рабочий день, Можно удаленно","Москва, Полный рабочий день","Москва, Полный рабочий день","Москва, Полный рабочий день, Можно удаленно","Москва, Полный рабочий день","Полный рабочий день, Можно удаленно","Полный рабочий день, Можно удаленно","Москва, Полный рабочий день","Полный рабочий день, Можно удаленно","Полный рабочий день, Можно удаленно","Москва, Полный рабочий день","Екатеринбург, Полный рабочий день","Екатеринбург, Полный рабочий день","Екатеринбург, Полный рабочий день, Можно удаленно","Екатеринбург, Полный рабочий день","Полный рабочий день, Можно удаленно","Санкт-Петербург, Полный рабочий день, Можно удаленно","Полный рабочий день, Можно удаленно","Полный рабочий день, Можно удаленно",Самара,"Полный рабочий день, Можно удаленно","Москва, Полный рабочий день, Можно удаленно","Москва, Полный рабочий день, Можно удаленно","Краснодар, Полный рабочий день","Санкт-Петербург, Полный рабочий день"
